### ISSUE TITLE
Carla client does not use sequential ports as it should

### ISSUE THREAD

**Issue by psarka** [carla-simulator/carla#3967]
Carla 0.9.11

When using carla client with non standard port (in my case `python config.py --host 192.168.0.111 --port 4000 --map Town04`), it does not work properly, as it is trying to use ports 4000 and 2001 instead of 4000 and 4001 as it should. Because of this we can't run multiple carla server instances as they all need 2001.

Here is a sample of tcp dump:

```
paulius@xps:~/bin$ sudo tcpdump -i any -n host 192.168.0.111
tcpdump: verbose output suppressed, use -v or -vv for full protocol decode
listening on any, link-type LINUX_SLL (Linux cooked v1), capture size 262144 bytes
17:08:27.297441 IP 10.8.0.6.56038 > 192.168.0.111.4000: Flags [S], seq 362599562, win 64240, options [mss 1460,sackOK,TS val 2095709709 ecr 0,nop,wscale 7], length 0
17:08:27.330382 IP 192.168.0.111.4000 > 10.8.0.6.56038: Flags [S.], seq 1081738969, ack 362599563, win 65160, options [mss 1352,sackOK,TS val 2409571097 ecr 2095709709,nop,wscale 7], length 0
17:08:27.330473 IP 10.8.0.6.56038 > 192.168.0.111.4000: Flags [.], ack 1, win 502, options [nop,nop,TS val 2095709742 ecr 2409571097], length 0
17:08:27.330965 IP 10.8.0.6.56038 > 192.168.0.111.4000: Flags [P.], seq 1:15, ack 1, win 502, options [nop,nop,TS val 2095709743 ecr 2409571097], length 14
17:08:27.363907 IP 192.168.0.111.4000 > 10.8.0.6.56038: Flags [.], ack 15, win 509, options [nop,nop,TS val 2409571130 ecr 2095709743], length 0
17:08:27.363961 IP 192.168.0.111.4000 > 10.8.0.6.56038: Flags [P.], seq 1:15, ack 15, win 509, options [nop,nop,TS val 2409571130 ecr 2095709743], length 14
17:08:27.363980 IP 10.8.0.6.56038 > 192.168.0.111.4000: Flags [.], ack 15, win 502, options [nop,nop,TS val 2095709776 ecr 2409571130], length 0
17:08:27.365223 IP 10.8.0.6.56038 > 192.168.0.111.4000: Flags [P.], seq 15:38, ack 15, win 502, options [nop,nop,TS val 2095709777 ecr 2409571130], length 23
17:08:27.400108 IP 192.168.0.111.4000 > 10.8.0.6.56038: Flags [.], ack 38, win 509, options [nop,nop,TS val 2409571166 ecr 2095709777], length 0
17:08:27.408380 IP 192.168.0.111.4000 > 10.8.0.6.56038: Flags [P.], seq 15:59, ack 38, win 509, options [nop,nop,TS val 2409571174 ecr 2095709777], length 44
17:08:27.408429 IP 10.8.0.6.56038 > 192.168.0.111.4000: Flags [.], ack 59, win 502, options [nop,nop,TS val 2095709820 ecr 2409571174], length 0
17:08:27.409645 IP 10.8.0.6.56038 > 192.168.0.111.4000: Flags [P.], seq 38:65, ack 59, win 502, options [nop,nop,TS val 2095709821 ecr 2409571174], length 27
17:08:27.409681 IP 10.8.0.6.45594 > 192.168.0.111.2001: Flags [S], seq 1490382952, win 64240, options [mss 1460,sackOK,TS val 2095709821 ecr 0,nop,wscale 7], length 0
17:08:27.443200 IP 192.168.0.111.4000 > 10.8.0.6.56038: Flags [.], ack 65, win 509, options [nop,nop,TS val 2409571209 ecr 2095709821], length 0
17:08:27.443270 IP 192.168.0.111.2001 > 10.8.0.6.45594: Flags [S.], seq 2242551765, ack 1490382953, win 65160, options [mss 1352,sackOK,TS val 827959792 ecr 2095709821,nop,wscale 7], length 0
17:08:27.443328 IP 10.8.0.6.45594 > 192.168.0.111.2001: Flags [.], ack 1, win 502, options [nop,nop,TS val 2095709855 ecr 827959792], length 0
17:08:27.443460 IP 10.8.0.6.45594 > 192.168.0.111.2001: Flags [P.], seq 1:5, ack 1, win 502, options [nop,nop,TS val 2095709855 ecr 827959792], length 4
17:08:27.462443 IP 192.168.0.111.4000 > 10.8.0.6.56038: Flags [P.], seq 59:88, ack 65, win 509, options [nop,nop,TS val 2409571228 ecr 2095709821], length 29
...
```

**Comment by germanros1987** [comment]
@bernatx could you address this issue?
